Fund Name,ManCo,Depositary,Auth_Date,First_Seen
Silchester International Investors (Ireland) Trust,Azimut Investments Limited,,2023-07-27,2026-04-29
Nomura Funds Ireland - US High Yield Bond Continuum Fund,Mercer Global Investments Management Limited,,2023-07-27,2026-04-29
Nomura Funds Ireland - Corporate Hybrid Bond Fund,Mercer Global Investments Management Limited,,2023-07-27,2026-04-29
iShares iBonds Dec 2027 Term $ Corp UCITS ETF,European and Global Investments Limited,Caceis Bank,2023-07-21,2026-04-29
KraneShares ICBCUBS S&P China 500 UCITS ETF,Hanetf Management Limited,,2023-07-21,2026-04-29
iShares iBonds Dec 2027 Term € Corp UCITS ETF,European and Global Investments Limited,Caceis Bank,2023-07-21,2026-04-29
HSBC MSCI Japan Islamic Screened UCITS ETF,HSBC Investment Funds (Luxembourg) SA,HSBC Continental Europe,2023-07-21,2026-04-29
iShares iBonds Dec 2025 Term $ Corp UCITS ETF,European and Global Investments Limited,Caceis Bank,2023-07-21,2026-04-29
HSBC Nasdaq Global Climate Tech UCITS ETF,HSBC Investment Funds (Luxembourg) SA,HSBC Continental Europe,2023-07-21,2026-04-29
iShares iBonds Dec 2025 Term $ Treasury UCITS ETF,European and Global Investments Limited,Caceis Bank,2023-07-21,2026-04-29
iShares iBonds Dec 2025 Term € Corp UCITS ETF,European and Global Investments Limited,Caceis Bank,2023-07-21,2026-04-29
Global Equity Index,Virtus International Fund Management Limited,,2023-07-20,2026-04-29
iShares iBonds Dec 2026 Term € Corp UCITS ETF,European and Global Investments Limited,Caceis Bank,2023-07-19,2026-04-29
iShares iBonds Dec 2028 Term $ Corp UCITS ETF,European and Global Investments Limited,Caceis Bank,2023-07-19,2026-04-29
iShares iBonds Dec 2026 Term $ Corp UCITS ETF,European and Global Investments Limited,Caceis Bank,2023-07-19,2026-04-29
iShares iBonds Dec 2028 Term € Corp UCITS ETF,European and Global Investments Limited,Caceis Bank,2023-07-19,2026-04-29
MetLife Emerging Markets Hard Currency Debt Fund,Azimut Investments Limited,,2023-07-17,2026-04-29
Mercer Sustainable Listed Infrastructure Feeder Fund,Mercer Global Investments Management Limited,,2023-07-14,2026-04-29
Perspective American Extended Alpha UCITS Fund,International Financial Services Centre,,2023-07-12,2026-04-29
GMO Quality Select Investment Fund,Aegon Investment Management B.V.,,2023-07-12,2026-04-29
New Capital USD Shield Fund,HSBC Continental Europe,,2023-07-12,2026-04-29
New Capital Climate Transition Equity Fund,HSBC Continental Europe,,2023-07-12,2026-04-29
GMO US Quality Investment Fund,Aegon Investment Management B.V.,,2023-07-12,2026-04-29
Selwood ESG Transition Credit UCITS Fund,International Financial Services Centre,,2023-07-11,2026-04-29
iShares EURO STOXX 50 ESG UCITS ETF,European and Global Investments Limited,Caceis Bank,2023-07-10,2026-04-29
Virtus GF AlphaSimplex Managed Futures Fund,Virtus International Fund Management Limited,,2023-07-10,2026-04-29
Invesco Bloomberg Commodity Carbon Tilted UCITS ETF,Invesco Investment Management Limited,,2023-07-04,2026-04-29
CCF Developed World Paris-Aligned Climate Index Fund,Hanetf Management Limited,,2023-07-04,2026-04-29
Amundi Core MSCI USA UCITS ETF,Katko Capital,Caceis Bank,2023-07-03,2026-04-29
Amundi Prime All Country World UCITS ETF,Katko Capital,Caceis Bank,2023-07-03,2026-04-29
Amundi MSCI World Climate Paris Aligned UCITS ETF,Katko Capital,Caceis Bank,2023-07-03,2026-04-29
Amundi MSCI USA ESG Broad Transition UCITS ETF,Katko Capital,Caceis Bank,2023-07-03,2026-04-29
Innovative Portfolios Preferred Income Fund,International Financial Services Centre,,2023-06-30,2026-04-29
KraneShares MSCI China Clean Technology Index UCITS ETF,Hanetf Management Limited,,2023-06-29,2026-04-29
Janus Henderson Fixed Maturity Bond Fund (EUR) 2027,Janus Henderson Investors Europe S.A.,,2023-06-29,2026-04-29
Janus Henderson Fixed Maturity Bond Fund (USD) 2027,Janus Henderson Investors Europe S.A.,,2023-06-29,2026-04-29
Smart Defence Single Strategy Fineco AM Fund,Fineco Asset Management dac,,2023-06-28,2026-04-29
Smart Defence Single Strategy Fineco AM Fund I,Fineco Asset Management dac,,2023-06-28,2026-04-29
Jupiter Global Emerging Markets Focus ex China Fund,Jupiter Asset Management Europe Limited,,2023-06-28,2026-04-29
BNY Mellon Long-Term European Equity Fund,BNY Mellon Fund Management (Luxembourg) S.A,,2023-06-28,2026-04-29
First Trust Bloomberg Scarce Resources UCITS ETF,First Trust Global Portfolios Management Limited,,2023-06-28,2026-04-29
First Trust Indxx Future Economy Metals UCITS ETF,First Trust Global Portfolios Management Limited,,2023-06-28,2026-04-29
Making Europe Great Again UCITS ETF,Hanetf Management Limited,,2023-06-26,2026-04-29
DRZ Emerging Markets Value Fund,Architas Multi-Manager Europe Limited,,2023-06-26,2026-04-29
Neuberger Berman Climate Innovation Fund,DWS Investment SA,,2023-06-23,2026-04-29
Global Fundamentals Fund,WisdomTree Management Limited,,2023-06-23,2026-04-29
J.P. Morgan Target Fund I,Insight Investment Management (Europe) Limited,,2023-06-23,2026-04-29
MUZINICH GLOBAL MARKET DURATION INVESTMENT GRADE FUND,Mediolanum International Funds Limited,Caceis Bank,2023-06-21,2026-04-29
Dynamic Profile Fineco AM Fund I,Fineco Asset Management dac,,2023-06-21,2026-04-29
Xtrackers MSCI World Value ESG UCITS ETF,DWS Investment SA,,2023-06-20,2026-04-29
Xtrackers MSCI World Momentum ESG UCITS ETF,DWS Investment SA,,2023-06-20,2026-04-29
Xtrackers MSCI World Minimum Volatility ESG UCITS ETF,DWS Investment SA,,2023-06-20,2026-04-29
Xtrackers MSCI World Quality ESG UCITS ETF,DWS Investment SA,,2023-06-20,2026-04-29
Invesco NASDAQ-100 Equal Weight UCITS ETF,Invesco Investment Management Limited,,2023-06-19,2026-04-29
Invesco Dow Jones US Insurance UCITS ETF,Invesco Investment Management Limited,,2023-06-19,2026-04-29
AXA IM Euro Credit PAB UCITS ETF,BNP Paribas Asset Management Europe,,2023-06-19,2026-04-29
Global X S&P 500® Covered Call UCITS ETF,Three Rock Capital Management Limited,,2023-06-16,2026-04-29
Franklin Future of Food UCITS ETF,Franklin Templeton International Services S.A.R.L.,,2023-06-16,2026-04-29
Chimera S&P Pakistan UCITS ETF,ING Solutions Investment Management S.A.,Caceis Bank,2023-06-16,2026-04-29
Franklin Future of Health and Wellness UCITS ETF,Franklin Templeton International Services S.A.R.L.,,2023-06-16,2026-04-29
Pzena Europe ex-UK Focused Value Fund,Pzena Investment Management Europe Limited,,2023-06-15,2026-04-29
Tycho Scopia Market Neutral Equity Fund,Blackstone Europe Fund Management SARL,,2023-06-15,2026-04-29
FAB One World Fund,European and Global Investments Limited,Caceis Bank,2023-06-14,2026-04-29
DART Fund,International Financial Services Centre,,2023-06-13,2026-04-29
JPMorgan ETFs (Ireland) ICAV - US Research Enhanced Index Equity SRI,Architas Multi-Manager Europe Limited,,2023-06-13,2026-04-29
JPMorgan ETFs (Ireland) ICAV - Global Research Enhanced Index Equity SRI,Architas Multi-Manager Europe Limited,,2023-06-13,2026-04-29
Amundi Sand Grove Event Driven Fund,Amundi Asset Management,,2023-06-12,2026-04-29
FTGF Martin Currie Improving Society Fund,Franklin Templeton International Services S.A.R.L.,,2023-06-12,2026-04-29
HC Cadira Sustainable Japan Equity Fund,Harrington Cooper Asset Management Limited,,2023-06-12,2026-04-29
Neuberger Berman Tactical Macro Fund,DWS Investment SA,,2023-06-09,2026-04-29
Neuberger Berman Developed Market FMP - 2027,DWS Investment SA,,2023-06-07,2026-04-29
ANIMA Systematic U.S. Corporate,BNP Paribas Asset Management Europe,,2023-06-07,2026-04-29
UBS S&P USA Dividend Aristocrats ESG Elite UCITS ETF,Virtus International Fund Management Limited,,2023-06-07,2026-04-29
L&G Gerd Kommer Multifactor Equity UCITS ETF,LGIM Managers (Europe) Limited,,2023-06-02,2026-04-29
Lord Abbett Global Health Care Fund,Alma Capital Investment Management,Caceis Bank,2023-06-02,2026-04-29
AXA IM Euro Yield Target 2028,BNP Paribas Asset Management Europe,,2023-06-02,2026-04-29
iShares Russell 1000 Growth UCITS ETF,Invesco Investment Management Limited,,2023-06-01,2026-04-29
iShares Copper Miners UCITS ETF,HSBC Investment Funds (Luxembourg) SA,HSBC Continental Europe,2023-06-01,2026-04-29
TT EM ex China Equity Fund,Perpetual Investment Services Europe Limited,,2023-06-01,2026-04-29
iShares Russell 1000 Value UCITS ETF,Invesco Investment Management Limited,,2023-06-01,2026-04-29
ANIMA Thematic XI,BNP Paribas Asset Management Europe,,2023-05-31,2026-04-29
Julius Baer Equity India,Three Rock Capital Management Limited,,2023-05-31,2026-04-29
James Hambro Harrier Fixed Income Fund,Azimut Investments Limited,,2023-05-26,2026-04-29
James Hambro Harrier Global Equities Fund,Azimut Investments Limited,,2023-05-26,2026-04-29
Trojan Global Income Fund (Ireland),Virtus International Fund Management Limited,,2023-05-26,2026-04-29
James Hambro Harrier Diversified Strategies Fund,Azimut Investments Limited,,2023-05-26,2026-04-29
"Dynamic Portfolio Fund, Generali Invest CEE plc","Generali Investments CEE investiční společnost, a.s.",,2023-05-24,2026-04-29
Excelsia Global Equity Fund,Architas Multi-Manager Europe Limited,,2023-05-24,2026-04-29
"Balanced Portfolio Fund, Generali Invest CEE plc","Generali Investments CEE investiční společnost, a.s.",,2023-05-24,2026-04-29
AMX UCITS CCF – DWS – Global Low Carbon Stewardship,DWS Investment SA,,2023-05-22,2026-04-29
Alpha Green UCITS Fund,Architas Multi-Manager Europe Limited,,2023-05-22,2026-04-29
Smart Defence Progression 2026 Fineco AM Fund V,Fineco Asset Management dac,,2023-05-22,2026-04-29
Janus Henderson Fallen Angels Bond ESG Active Core UCITS ETF,Fineco Asset Management dac,,2023-05-18,2026-04-29
UBS CMCI Future Commodity SF UCITS ETF,Architas Multi-Manager Europe Limited,,2023-05-18,2026-04-29
Virtus GF Emerging Markets High Dividend Fund,Virtus International Fund Management Limited,,2023-05-16,2026-04-29
Fineco AM MSCI EM with China A share Inclusion Select Fund,Fineco Asset Management dac,,2023-05-15,2026-04-29
Fineco AM MSCI AC Asia Pacific ex Japan with China A share Inclusion Select,Fineco Asset Management dac,,2023-05-15,2026-04-29
Liontrust GF Sustainable Future US Growth Fund,LGIM Managers (Europe) Limited,,2023-05-12,2026-04-29
Brown Advisory US Sustainable Value Fund,Blackstone Europe Fund Management SARL,,2023-05-12,2026-04-29
Man Financial Credit Opportunities,LGIM Managers (Europe) Limited,,2023-05-11,2026-04-29
CCB Principal China New Energy Innovation Fund,Summit Asset Managers Limited,,2023-05-11,2026-04-29
Federated Hermes Short-Term Euro Prime Fund,Summit Asset Managers Limited,,2023-05-11,2026-04-29
Smart Global Defence 2026 Fineco AM Fund II,Fineco Asset Management dac,,2023-05-10,2026-04-29
Quintet Global Equity Defined Returns Fund,International Financial Services Centre,,2023-05-10,2026-04-29
Man European Leaders Alternative,LGIM Managers (Europe) Limited,,2023-05-09,2026-04-29
Invesco FTSE All-World UCITS ETF,Invesco Investment Management Limited,,2023-05-09,2026-04-29
Garnacha Equities Fund,BNP Paribas Asset Management Europe,,2023-05-05,2026-04-29
Citrine Global Multi-Asset Fund,Gateway Fund Services Limited,,2023-05-05,2026-04-29
Rize Circular Economy Enablers UCITS ETF,European and Global Investments Limited,Caceis Bank,2023-05-04,2026-04-29
WisdomTree Renewable Energy UCITS ETF,WisdomTree Management Limited,,2023-04-26,2026-04-29
Barings Global High Yield Bond Climate Fund,Sector Fund Services AS,,2023-04-26,2026-04-29
Smart Defence Multi-Strategy 2029 Fineco AM Fund,Fineco Asset Management dac,,2023-04-24,2026-04-29
Mediolanum Global Equity Style Selection,Mediolanum International Funds Limited,Caceis Bank,2023-04-24,2026-04-29
Pacific North American Opportunities,VanEck Asset Management B.V.,,2023-04-21,2026-04-29
Thornbridge Nissay Japan Contrarian Value Equity Fund,Harrington Cooper Asset Management Limited,,2023-04-21,2026-04-29
Lord Abbett Short Duration High Yield Fund,Alma Capital Investment Management,Caceis Bank,2023-04-21,2026-04-29
Smart Global Defence 2030 Fineco AM Fund,Fineco Asset Management dac,,2023-04-20,2026-04-29
Nomura Funds Ireland - Taiwan Equity Fund,Mercer Global Investments Management Limited,,2023-04-20,2026-04-29
Westbeck Volta UCITS Fund,International Financial Services Centre,,2023-04-18,2026-04-29
Goehring & Rozencwajg Resources Fund,Katko Capital,Caceis Bank,2023-04-14,2026-04-29
AZ ALLOCATION – GLOBAL GOALS,Azimut Investments Limited,,2023-04-14,2026-04-29
AZ EQUITY – SPACE,Azimut Investments Limited,,2023-04-14,2026-04-29
AZ EQUITY – NEW GENERATIONS,Azimut Investments Limited,,2023-04-14,2026-04-29
Mazi Global Equity Fund,Architas Multi-Manager Europe Limited,,2023-04-14,2026-04-29
Azimut Thematic Fund,Azimut Investments Limited,,2023-04-14,2026-04-29
Twelve Multi Strategy Fund,MULTICONCEPT FUND MANAGEMENT SA,,2023-04-13,2026-04-29
Cusana Emerging Markets Equities Fund,Sector Fund Services AS,,2023-04-13,2026-04-29
Evelyn Defensive Growth Fund,DWS Investment SA,,2023-04-12,2026-04-29
BlackRock Euro Investment Grade Fixed Maturity Bond Fund 2026,Summit Asset Managers Limited,,2023-04-11,2026-04-29
DB Autocallable Portfolio Fund,HSBC Investment Funds (Luxembourg) SA,HSBC Continental Europe,2023-04-11,2026-04-29
Mercer Sustainable Listed Infrastructure UCITS CCF,Mercer Global Investments Management Limited,,2023-04-05,2026-04-29
ClucasGray Global Fund,Architas Multi-Manager Europe Limited,,2023-04-04,2026-04-29
Invesco EUR Government and Related Green Bond Weighted UCITS ETF,Invesco Investment Management Limited,,2023-04-03,2026-04-29
WMP Satellite Equity,Katko Capital,Caceis Bank,2023-03-31,2026-04-29
Future of Defence UCITS ETF,Hanetf Management Limited,,2023-03-30,2026-04-29
Hotchkis & Wiley Global Value Equity Fund,Blackstone Europe Fund Management SARL,,2023-03-30,2026-04-29
UBS MSCI Australia Universal UCITS ETF,Virtus International Fund Management Limited,,2023-03-30,2026-04-29
UBS MSCI AC Asia ex Japan Selection UCITS ETF,Virtus International Fund Management Limited,,2023-03-30,2026-04-29
Algebris Strategic Credit Fund,HSBC Continental Europe,,2023-03-30,2026-04-29
Fineco AM US Dollar Bond Fund,Fineco Asset Management dac,,2023-03-30,2026-04-29
Tabula Global High Yield Credit UCITS Fund,Fineco Asset Management dac,,2023-03-29,2026-04-29
BNP PARIBAS EASY ECPI GLOBAL ESG INFRASTRUCTURE UCITS ETF,BNP Paribas Asset Management Europe,,2023-03-27,2026-04-29
Julius Baer Global Income Opportunities,Three Rock Capital Management Limited,,2023-03-27,2026-04-29
Ossiam ESG Shiller Barclays CAPE® Global Sector UCITS ETF,MULTICONCEPT FUND MANAGEMENT SA,,2023-03-27,2026-04-29
BNP PARIBAS EASY ICAV,BNP Paribas Asset Management Europe,,2023-03-27,2026-04-29
Granahan Future Pathways Fund,Alma Capital Investment Management,Caceis Bank,2023-03-27,2026-04-29
BNP Paribas Easy S&P 500 Scored and Screened UCITS ETF,BNP Paribas Asset Management Europe,,2023-03-27,2026-04-29
BNP Paribas Easy MSCI World Min TE UCITS ETF,BNP Paribas Asset Management Europe,,2023-03-27,2026-04-29
Royal London Short Duration Emerging Markets Corporate Bond Fund,Insight Investment Management (Europe) Limited,,2023-03-22,2026-04-29
Royal London Emerging Markets Corporate Bond Fund,Insight Investment Management (Europe) Limited,,2023-03-22,2026-04-29
BlackRock Global Allocation Tailored Fund,Insight Investment Management (Europe) Limited,,2023-03-20,2026-04-29
ANIMA Thematic X,BNP Paribas Asset Management Europe,,2023-03-20,2026-04-29
Xtrackers Nordic Net Zero Pathway Paris Aligned UCITS ETF,DWS Investment SA,,2023-03-16,2026-04-29
Invesco S&P World Energy Targeted & Screened UCITS ETF,Invesco Investment Management Limited,,2023-03-13,2026-04-29
Invesco S&P World Financials ESG UCITS ETF,Invesco Investment Management Limited,,2023-03-13,2026-04-29
Invesco S&P World Health Care ESG UCITS ETF,Invesco Investment Management Limited,,2023-03-13,2026-04-29
Invesco S&P World Information Technology ESG UCITS ETF,Invesco Investment Management Limited,,2023-03-13,2026-04-29
VanEck Defense UCITS ETF,VanEck Asset Management B.V.,,2023-03-10,2026-04-29
Amplify Global Equity Fund,WisdomTree Management Limited,,2023-03-09,2026-04-29
Man Asia Credit Opportunities,Goldman Sachs Asset Management Fund Services Limited,,2023-03-09,2026-04-29
Guinness China A Share Fund,LGIM Managers (Europe) Limited,,2023-03-08,2026-04-29
Guinness China RMB Income Fund,LGIM Managers (Europe) Limited,,2023-03-08,2026-04-29
VanEck Oil Services UCITS ETF,VanEck Asset Management B.V.,,2023-03-07,2026-04-29
Emerging Market ex-China Stars Fund,Perpetual Investment Services Europe Limited,,2023-03-06,2026-04-29
State Street Emerging Markets ESG Screened Local Currency Government Bond,International Financial Services Centre,,2023-03-03,2026-04-29
State Street Emerging Markets ESG Screened Hard Currency Government Bond,International Financial Services Centre,,2023-03-03,2026-04-29
Smart Global Defence 2029 Fineco AM Fund III,Fineco Asset Management dac,,2023-03-02,2026-04-29
J.P. Morgan Target Fund 2027,Insight Investment Management (Europe) Limited,,2023-03-01,2026-04-29
Virtus GF Clean Energy Fund,Virtus International Fund Management Limited,,2023-02-28,2026-04-29
Virtus GF U.S. Small-Mid Cap Fund,Virtus International Fund Management Limited,,2023-02-28,2026-04-29
Smart Global Defence 2026 Fineco AM Fund,Fineco Asset Management dac,,2023-02-28,2026-04-29
ECP Global Growth Fund,Gateway Fund Services Limited,,2023-02-27,2026-04-29
ECP UCITS ICAV,Gateway Fund Services Limited,,2023-02-27,2026-04-29
Coronation Multi-Manager Global Equity Fund,LGIM Managers (Europe) Limited,,2023-02-20,2026-04-29
New Capital Fixed Maturity Bond Fund 2026,HSBC Continental Europe,,2023-02-15,2026-04-29
Melqart Event Driven UCITS Fund,VanEck Asset Management B.V.,,2023-02-14,2026-04-29
Acadian Global Enhanced Equity Feeder Fund,Mercer Global Investments Management Limited,,2023-02-14,2026-04-29
Universal Investment Ireland UCITS Platform ICAV,Investlinx Investment Management Limited,Caceis Bank,2023-02-08,2026-04-29
Global Dividend Income Fund UI,Investlinx Investment Management Limited,Caceis Bank,2023-02-08,2026-04-29
Xtrackers Global Aggregate Corporate Bond 1-10 Index Fund,DWS Investment SA,,2023-02-03,2026-04-29
Global X S&P 500® Quarterly Buffer UCITS ETF,Three Rock Capital Management Limited,,2023-02-02,2026-04-29
Global X S&P 500® Quarterly Tail Hedge UCITS ETF,Three Rock Capital Management Limited,,2023-02-02,2026-04-29
Fineco AM Passive Underlyings 8 Target 2026,Fineco Asset Management dac,,2023-02-01,2026-04-29
Smart Global Defence 2029 Fineco AM Fund II,Fineco Asset Management dac,,2023-01-30,2026-04-29
Global Thematic Equity Fund,Summit Asset Managers Limited,,2023-01-19,2026-04-29
J.P. Morgan Target Fund 2029,Insight Investment Management (Europe) Limited,,2023-01-10,2026-04-29
MPS Target Fund 2026,Insight Investment Management (Europe) Limited,,2023-01-10,2026-04-29
VanEck Uranium and Nuclear Technologies UCITS ETF,VanEck Asset Management B.V.,,2023-01-05,2026-04-29
Man Emerging Markets Corporate Credit Alternative,LGIM Managers (Europe) Limited,,2022-12-22,2026-04-29
GIB AM European Focus Fund,MULTICONCEPT FUND MANAGEMENT SA,,2022-12-22,2026-04-29
Horizon Kinetics Full-Cycle Inflation Equity Fund UCITS ETF,Investlinx Investment Management Limited,Caceis Bank,2022-12-22,2026-04-29
Evelyn Multi-Asset Growth Fund,DWS Investment SA,,2022-12-20,2026-04-29
Evelyn Multi-Asset Maximum Growth Fund,DWS Investment SA,,2022-12-20,2026-04-29
Evelyn Multi-Asset Adventurous Fund,DWS Investment SA,,2022-12-20,2026-04-29
Evelyn Multi-Asset Balanced Fund,DWS Investment SA,,2022-12-20,2026-04-29
Canaccord Genuity Thematic ESG Fund,Insight Investment Management (Europe) Limited,,2022-12-14,2026-04-29
Investlinx ICAV,Investlinx Investment Management Limited,Caceis Bank,2022-12-14,2026-04-29
Investlinx Balanced Income UCITS ETF,Investlinx Investment Management Limited,Caceis Bank,2022-12-14,2026-04-29
Investlinx Capital Appreciation UCITS ETF,Investlinx Investment Management Limited,Caceis Bank,2022-12-14,2026-04-29
CI Better World Growth Fund,International Financial Services Centre,,2022-12-13,2026-04-29
Grand Barie Lewer Multi Asset Class Fund,Gateway Fund Services Limited,,2022-12-13,2026-04-29
Fortem Capital Absolute Return Fund,VanEck Asset Management B.V.,,2022-12-12,2026-04-29
Smart Defence Equity 2029 Fineco AM Fund,Fineco Asset Management dac,,2022-12-09,2026-04-29
Smart Global Defence 2029 Fineco AM Fund,Fineco Asset Management dac,,2022-12-09,2026-04-29
Vunani Global Equity Fund,Architas Multi-Manager Europe Limited,,2022-12-09,2026-04-29
Enam India Opportunities Fund,BNP Paribas Asset Management Europe,,2022-12-08,2026-04-29
Man GLG Core Economy Alternative,LGIM Managers (Europe) Limited,,2022-11-29,2026-04-29
E.P.I.C. Global Multi-Asset Fund,Architas Multi-Manager Europe Limited,,2022-11-28,2026-04-29
CIRCA5000 Sustainable Food & Biodiversity UCITS ETF,BNP Paribas Asset Management Europe,,2022-11-28,2026-04-29
CIRCA5000 Clean Water & Waste UCITS ETF,BNP Paribas Asset Management Europe,,2022-11-28,2026-04-29
CIRCA5000 Green Energy & Technology UCITS ETF,BNP Paribas Asset Management Europe,,2022-11-28,2026-04-29
CIRCA5000 ICAV,BNP Paribas Asset Management Europe,,2022-11-28,2026-04-29
CIRCA5000 Social & Economic Empowerment UCITS ETF,BNP Paribas Asset Management Europe,,2022-11-28,2026-04-29
CIRCA5000 Health & Wellbeing UCITS ETF,BNP Paribas Asset Management Europe,,2022-11-28,2026-04-29
Amundi S&P 500 Climate Paris Aligned UCITS ETF,Katko Capital,Caceis Bank,2022-11-23,2026-04-29
Amundi S&P 500 Screened UCITS ETF,Katko Capital,Caceis Bank,2022-11-23,2026-04-29
Amundi MSCI USA ESG Selection UCITS ETF,Katko Capital,Caceis Bank,2022-11-23,2026-04-29
Amundi MSCI USA SRI Climate Paris Aligned UCITS ETF,Katko Capital,Caceis Bank,2022-11-23,2026-04-29
Amundi MSCI World ESG Selection UCITS ETF,Katko Capital,Caceis Bank,2022-11-23,2026-04-29
Amundi MSCI World SRI Climate Paris Aligned UCITS ETF,Katko Capital,Caceis Bank,2022-11-23,2026-04-29
Amundi MSCI World ESG Broad Transition UCITS ETF,Katko Capital,Caceis Bank,2022-11-23,2026-04-29
Amundi MSCI North America ESG Broad Transition UCITS ETF,Katko Capital,Caceis Bank,2022-11-23,2026-04-29
"Xtrackers MSCI Global SDG 9 Industry, Innovation & Infrastructure UCITS",DWS Investment SA,,2022-11-22,2026-04-29
Xtrackers MSCI Emerging Markets Climate Transition UCITS ETF,DWS Investment SA,,2022-11-22,2026-04-29
Xtrackers MSCI Japan Climate Transition UCITS ETF,DWS Investment SA,,2022-11-22,2026-04-29
Xtrackers MSCI Global SDG 11 Sustainable Cities UCITS ETF,DWS Investment SA,,2022-11-22,2026-04-29
Janus Henderson FTSE Indian Government Bond Short Duration Core UCITS,Fineco Asset Management dac,,2022-11-22,2026-04-29
Xtrackers MSCI Global Circular Economy UCITS ETF,DWS Investment SA,,2022-11-22,2026-04-29
Xtrackers MSCI Europe Climate Transition UCITS ETF,DWS Investment SA,,2022-11-22,2026-04-29
Xtrackers MSCI EMU Climate Transition UCITS ETF,DWS Investment SA,,2022-11-22,2026-04-29
Xtrackers MSCI World Climate Transition UCITS ETF,DWS Investment SA,,2022-11-22,2026-04-29
Xtrackers MSCI USA Climate Transition UCITS ETF,DWS Investment SA,,2022-11-22,2026-04-29
Rockefeller US Equity Concentrated UCITS,Goldman Sachs Asset Management Fund Services Limited,,2022-11-21,2026-04-29
ANIMA Thematic IX,BNP Paribas Asset Management Europe,,2022-11-21,2026-04-29
JPMorgan ETFs (Ireland) ICAV - Green Social Sustainable Bond Active UCITS,Architas Multi-Manager Europe Limited,,2022-11-18,2026-04-29
Smart Global Defence 2028 Fineco AM Fund II,Fineco Asset Management dac,,2022-11-18,2026-04-29
Julius Baer Strategy Balanced (EUR),Three Rock Capital Management Limited,,2022-11-17,2026-04-29
Julius Baer Equity Next Generation,Three Rock Capital Management Limited,,2022-11-17,2026-04-29
Julius Baer Equity Global Excellence US,Three Rock Capital Management Limited,,2022-11-17,2026-04-29
Julius Baer Equity Global Excellence Europe,Three Rock Capital Management Limited,,2022-11-17,2026-04-29
Julius Baer Fixed Income Investment Grade Corporate (EUR),Three Rock Capital Management Limited,,2022-11-17,2026-04-29
Julius Baer Equity Global Excellence,Three Rock Capital Management Limited,,2022-11-17,2026-04-29
Julius Baer Strategy Income (USD),Three Rock Capital Management Limited,,2022-11-17,2026-04-29
Julius Baer Strategy Income (EUR),Three Rock Capital Management Limited,,2022-11-17,2026-04-29
Julius Baer Strategy Income (CHF),Three Rock Capital Management Limited,,2022-11-17,2026-04-29
Julius Baer Strategy Balanced (USD),Three Rock Capital Management Limited,,2022-11-17,2026-04-29
Julius Baer Equity Asia,Three Rock Capital Management Limited,,2022-11-17,2026-04-29
Julius Baer Strategy Balanced (CHF),Three Rock Capital Management Limited,,2022-11-17,2026-04-29
Julius Baer Dynamic Asset Allocation,Three Rock Capital Management Limited,,2022-11-17,2026-04-29
Julius Baer Fixed Income Asia,Three Rock Capital Management Limited,,2022-11-17,2026-04-29
Julius Baer Asia REITs,Three Rock Capital Management Limited,,2022-11-17,2026-04-29
Julius Baer Multi-Manager Fixed Income Unconstrained,Three Rock Capital Management Limited,,2022-11-17,2026-04-29
Julius Baer Global Growth GBP,Three Rock Capital Management Limited,,2022-11-15,2026-04-29
Old Mutual Applied Intelligence Equity Fund,Summit Asset Managers Limited,,2022-11-15,2026-04-29
Old Mutual Global ESG Equity Fund,Summit Asset Managers Limited,,2022-11-15,2026-04-29
Aryabhata Global Assets Funds ICAV,BNP Paribas Asset Management Europe,,2022-11-10,2026-04-29
Aryabhata India Fund,BNP Paribas Asset Management Europe,,2022-11-10,2026-04-29
New Capital Fixed Maturity Bond Fund 2025,HSBC Continental Europe,,2022-11-10,2026-04-29
Arrowstreet Global Universal Equity CCF,Amundi Asset Management,,2022-11-08,2026-04-29
Value Partners Asian Food and Nutrition Fund,Virtus International Fund Management Limited,,2022-11-07,2026-04-29
Sands Capital Global Shariah Fund,Architas Multi-Manager Europe Limited,,2022-11-04,2026-04-29
