Fund Name,ManCo,Depositary,Auth_Date,First_Seen
Man Event Driven Alternative,LGIM Managers (Europe) Limited,,2019-06-21,2026-04-29
NT Sterling Conservative Ultra Short Select Bond Fund,Pzena Investment Management Europe Limited,,2019-06-20,2026-04-29
TAM Balanced Fund,Gateway Fund Services Limited,Caceis Bank,2019-06-18,2026-04-29
L&G Clean Water UCITS ETF,LGIM Managers (Europe) Limited,,2019-06-17,2026-04-29
L&G Healthcare Technology & Innovation UCITS ETF,LGIM Managers (Europe) Limited,,2019-06-17,2026-04-29
L&G Artificial Intelligence UCITS ETF,LGIM Managers (Europe) Limited,,2019-06-17,2026-04-29
Veritas Third Eye Global Emerging Markets Fund,Franklin Templeton International Services S.A.R.L.,,2019-06-17,2026-04-29
Primus Fixed Income Smart Beta Fund,HSBC Investment Funds (Luxembourg) SA,HSBC Continental Europe,2019-06-06,2026-04-29
NT World Small Cap Low Carbon Equity Index Fund,Virtus International Fund Management Limited,,2019-06-04,2026-04-29
Muzinich Global Short Duration Investment Grade Fund,Mediolanum International Funds Limited,Caceis Bank,2019-05-31,2026-04-29
The Colchester Global Aggregate Bond Fund,Colchester Global Investors (Dublin) Management Limited,,2019-05-30,2026-04-29
The Colchester Global Green Bond Fund,Colchester Global Investors (Dublin) Management Limited,,2019-05-30,2026-04-29
Legg Mason Diversified Global Credit Fixed Maturity Bond Fund 2023,Franklin Templeton International Services S.A.R.L.,,2019-05-28,2026-04-29
Payden Global Emerging Markets Bond Fund (Hard Currency),BNP Paribas Asset Management Europe,,2019-05-28,2026-04-29
iShares MSCI World Financials Sector Advanced UCITS ETF,European and Global Investments Limited,Caceis Bank,2019-05-24,2026-04-29
iShares MSCI World Health Care Sector Advanced UCITS ETF,European and Global Investments Limited,Caceis Bank,2019-05-24,2026-04-29
HSBC Global Funds ICAV - China Government Local Bond UCITS ETF,HSBC Investment Funds (Luxembourg) SA,HSBC Continental Europe,2019-05-24,2026-04-29
iShares MSCI World Industrials Sector Advanced UCITS ETF,European and Global Investments Limited,Caceis Bank,2019-05-24,2026-04-29
iShares MSCI World Energy Sector Advanced UCITS ETF,European and Global Investments Limited,Caceis Bank,2019-05-24,2026-04-29
iShares MSCI World Consumer Staples Sector Advanced UCITS ETF,European and Global Investments Limited,Caceis Bank,2019-05-24,2026-04-29
iShares MSCI World Information Technology Sector Advanced UCITS ETF,European and Global Investments Limited,Caceis Bank,2019-05-24,2026-04-29
iShares MSCI World Consumer Discretionary Sector Advanced UCITS ETF,European and Global Investments Limited,Caceis Bank,2019-05-24,2026-04-29
iShares MSCI World Communication Services Sector Advanced UCITS ETF,European and Global Investments Limited,Caceis Bank,2019-05-24,2026-04-29
iShares MSCI World Materials Sector Advanced UCITS ETF,European and Global Investments Limited,Caceis Bank,2019-05-24,2026-04-29
iShares MSCI World Energy Sector UCITS ETF,European and Global Investments Limited,Caceis Bank,2019-05-24,2026-04-29
Multi-Asset Strategy Fund,Architas Multi-Manager Europe Limited,,2019-05-23,2026-04-29
KBI Eco Water Fund (ICAV),Franklin Templeton International Services S.A.R.L.,,2019-05-23,2026-04-29
J.P. Morgan Mansart European Put Write Strategy Fund,Insight Investment Management (Europe) Limited,,2019-05-21,2026-04-29
ANIMA Brightview -III,BNP Paribas Asset Management Europe,,2019-05-16,2026-04-29
ANIMA Brightview -II,BNP Paribas Asset Management Europe,,2019-05-16,2026-04-29
BNY Mellon Absolute Return Global Convertible Fund,BNY Mellon Fund Management (Luxembourg) S.A,,2019-05-15,2026-04-29
JPMorgan ETFs (Ireland) ICAV - Global Equity Multi-Factor UCITS ETF,Architas Multi-Manager Europe Limited,,2019-05-15,2026-04-29
JPMorgan ETFs (Ireland) ICAV - BetaBuilders US Treasury Bond 0-1 yr,Architas Multi-Manager Europe Limited,,2019-05-15,2026-04-29
Invesco MSCI Europe Universal Screened UCITS ETF,Invesco Investment Management Limited,,2019-05-10,2026-04-29
Invesco MSCI USA Universal Screened UCITS ETF,Invesco Investment Management Limited,,2019-05-10,2026-04-29
Invesco MSCI World Universal Screened UCITS ETF,Invesco Investment Management Limited,,2019-05-10,2026-04-29
Stonehorn Asia Equity Fund,Harrington Cooper Asset Management Limited,,2019-05-10,2026-04-29
ANIMA Brightview 2025-I,BNP Paribas Asset Management Europe,,2019-05-03,2026-04-29
L&G Multi-Strategy Enhanced Commodities UCITS ETF,LGIM Managers (Europe) Limited,,2019-04-24,2026-04-29
Chinese Road Opportunity,Mediolanum International Funds Limited,Caceis Bank,2019-04-18,2026-04-29
Global Small Cap Equity,Mediolanum International Funds Limited,Caceis Bank,2019-04-18,2026-04-29
Mercer Multi Asset Moderate Growth Fund,Mercer Global Investments Management Limited,,2019-04-18,2026-04-29
Global Leaders,Mediolanum International Funds Limited,Caceis Bank,2019-04-18,2026-04-29
Mercer Multi Asset Defensive Fund,Mercer Global Investments Management Limited,,2019-04-18,2026-04-29
Emerging Markets Fixed Income,Mediolanum International Funds Limited,Caceis Bank,2019-04-18,2026-04-29
Mercer Multi Asset High Growth Fund,Mercer Global Investments Management Limited,,2019-04-18,2026-04-29
Mercer Multi Asset Growth Fund,Mercer Global Investments Management Limited,,2019-04-18,2026-04-29
Ossiam US Equity Factors Screened UCITS ETF,MULTICONCEPT FUND MANAGEMENT SA,,2019-04-17,2026-04-29
Ossiam US Minimum Variance Screened NR UCITS ETF,MULTICONCEPT FUND MANAGEMENT SA,,2019-04-17,2026-04-29
iShares MSCI China UCITS ETF,HSBC Investment Funds (Luxembourg) SA,HSBC Continental Europe,2019-04-16,2026-04-29
SEB Impact Fund,Blackstone Europe Fund Management SARL,,2019-04-15,2026-04-29
Movestic Avancera 85,One Fund Management SA,,2019-04-12,2026-04-29
Movestic Avancera 75,One Fund Management SA,,2019-04-12,2026-04-29
iShares Euro Corporate Bond ESG SRI Index Fund (IE),DWS Investment SA,,2019-04-11,2026-04-29
Mercer Passive Short Dated UK Gilt Fund,Mercer Global Investments Management Limited,,2019-04-08,2026-04-29
Harrington Cooper UCITS Funds ICAV,Harrington Cooper Asset Management Limited,,2019-04-05,2026-04-29
Nomura Funds Ireland - Global Sustainable Equity Fund,Mercer Global Investments Management Limited,,2019-04-02,2026-04-29
American Century Concentrated Global Growth Equity Fund,Mercer Global Investments Management Limited,,2019-04-02,2026-04-29
American Century Emerging Markets Equity Fund,Mercer Global Investments Management Limited,,2019-04-02,2026-04-29
American Century Global Small Cap Equity Fund,Mercer Global Investments Management Limited,,2019-04-02,2026-04-29
American Century Global Growth Equity Fund,Mercer Global Investments Management Limited,,2019-04-02,2026-04-29
VanEck Video Gaming and eSports UCITS ETF,VanEck Asset Management B.V.,,2019-04-02,2026-04-29
Wellington Euro High Yield Bond Fund,Janus Henderson Investors Europe S.A.,,2019-03-29,2026-04-29
The Optima Lloyd George Asia Fund,Blackstone Europe Fund Management SARL,,2019-03-28,2026-04-29
Franklin Sustainable Euro Green Bond UCITS ETF,Franklin Templeton International Services S.A.R.L.,,2019-03-27,2026-04-29
Franklin FTSE China UCITS ETF,Franklin Templeton International Services S.A.R.L.,,2019-03-27,2026-04-29
Franklin FTSE Brazil UCITS ETF,Franklin Templeton International Services S.A.R.L.,,2019-03-27,2026-04-29
Franklin FTSE Korea UCITS ETF,Franklin Templeton International Services S.A.R.L.,,2019-03-27,2026-04-29
Franklin FTSE India UCITS ETF,Franklin Templeton International Services S.A.R.L.,,2019-03-27,2026-04-29
Descartes Alternative Credit UCITS Fund,International Financial Services Centre,,2019-03-26,2026-04-29
Franchise Partners Global Equity Fund II,Architas Multi-Manager Europe Limited,,2019-03-25,2026-04-29
FTGS BRI Multi-Asset Strategy,Franklin Templeton International Services S.A.R.L.,,2019-03-22,2026-04-29
The United States Dollar VNAV Fund,FIL Investment Management (Luxembourg) S.à r.l.,,2019-03-18,2026-04-29
The Sterling VNAV Fund,FIL Investment Management (Luxembourg) S.à r.l.,,2019-03-18,2026-04-29
The Euro VNAV Fund,FIL Investment Management (Luxembourg) S.à r.l.,,2019-03-18,2026-04-29
PGIM Emerging Market Total Return Bond Fund,Alma Capital Investment Management,Caceis Bank,2019-03-15,2026-04-29
UBS S&P 500 Scored & Screened UCITS ETF,Virtus International Fund Management Limited,,2019-03-14,2026-04-29
AXA IM Wave Biotech Fund,BNP Paribas Asset Management Europe,,2019-03-14,2026-04-29
DSP India Bond Fund,Goldman Sachs Asset Management Fund Services Limited,,2019-03-13,2026-04-29
DSP India Equity Fund,Goldman Sachs Asset Management Fund Services Limited,,2019-03-13,2026-04-29
Global Emerging Markets Equity Fund,Alma Capital Investment Management,Caceis Bank,2019-03-11,2026-04-29
Harbor Health Care UCITS ETF,Hanetf Management Limited,,2019-03-08,2026-04-29
Rockefeller Capital Management UCITS ICAV,Goldman Sachs Asset Management Fund Services Limited,,2019-03-07,2026-04-29
HSBC Global Funds ICAV - Global Emerging Market Government Local Bond,HSBC Investment Funds (Luxembourg) SA,HSBC Continental Europe,2019-03-07,2026-04-29
Rockefeller Global Equity Improvers UCITS,Goldman Sachs Asset Management Fund Services Limited,,2019-03-07,2026-04-29
Rockefeller US Equity Improvers UCITS,Goldman Sachs Asset Management Fund Services Limited,,2019-03-07,2026-04-29
Marlborough ICAV,Goldman Sachs Asset Management Fund Services Limited,,2019-03-07,2026-04-29
Marlborough Adventurous Fund,Goldman Sachs Asset Management Fund Services Limited,,2019-03-07,2026-04-29
Marlborough Balanced Fund,Goldman Sachs Asset Management Fund Services Limited,,2019-03-07,2026-04-29
Marlborough Cautious Fund,Goldman Sachs Asset Management Fund Services Limited,,2019-03-07,2026-04-29
HSBC Global Funds ICAV - Global Emerging Market Government Bond Index,HSBC Investment Funds (Luxembourg) SA,HSBC Continental Europe,2019-03-07,2026-04-29
Marlborough Defensive Fund,Goldman Sachs Asset Management Fund Services Limited,,2019-03-07,2026-04-29
ANIMA Zephyr Global Allocation,BNP Paribas Asset Management Europe,,2019-03-06,2026-04-29
Mercer Short Duration Bond Fund 3,Mercer Global Investments Management Limited,,2019-03-06,2026-04-29
Goldman Sachs ActiveBeta® Emerging Markets Equity UCITS ETF,Goldman Sachs Asset Management Fund Services Limited,,2019-03-05,2026-04-29
Goldman Sachs ActiveBeta® Paris-Aligned Sustainable US Large Cap Equity,Goldman Sachs Asset Management Fund Services Limited,,2019-03-05,2026-04-29
Goldman Sachs ETF ICAV,Goldman Sachs Asset Management Fund Services Limited,,2019-03-05,2026-04-29
PIMCO Obbligazionario Prudente Fund,Architas Multi-Manager Europe Limited,,2019-02-27,2026-04-29
Invesco Euro Government Bond 1-3 Year UCITS ETF,Invesco Investment Management Limited,,2019-02-25,2026-04-29
Invesco UK Gilts UCITS ETF,Invesco Investment Management Limited,,2019-02-25,2026-04-29
Invesco UK Gilt 1-5 Year UCITS ETF,Invesco Investment Management Limited,,2019-02-25,2026-04-29
Invesco Euro Government Bond UCITS ETF,Invesco Investment Management Limited,,2019-02-25,2026-04-29
Invesco Euro Government Bond 7-10 Year UCITS ETF,Invesco Investment Management Limited,,2019-02-25,2026-04-29
Lord Abbett High Yield Core Fund,Alma Capital Investment Management,Caceis Bank,2019-02-25,2026-04-29
Invesco Euro Government Bond 5-7 Year UCITS ETF,Invesco Investment Management Limited,,2019-02-25,2026-04-29
Invesco Euro Government Bond 3-5 Year UCITS ETF,Invesco Investment Management Limited,,2019-02-25,2026-04-29
PIMCO StocksPLUS AR Fund,Jupiter Asset Management Europe Limited,,2019-02-22,2026-04-29
Capital Gearing Portfolio Fund,Franklin Templeton International Services S.A.R.L.,,2019-02-21,2026-04-29
WisdomTree USD Floating Rate Treasury Bond UCITS ETF,WisdomTree Management Limited,,2019-02-21,2026-04-29
Mercer Passive Fundamental Indexation Global Equity UCITS CCF,Mercer Global Investments Management Limited,,2019-02-20,2026-04-29
Mercer UCITS Common Contractual Fund,Mercer Global Investments Management Limited,,2019-02-20,2026-04-29
Mercer Passive Climate Transition Listed Infrastructure UCITS CCF,Mercer Global Investments Management Limited,,2019-02-20,2026-04-29
Mercer Passive Global REITS UCITS CCF,Mercer Global Investments Management Limited,,2019-02-20,2026-04-29
Mercer Passive Global Small Cap Equity UCITS CCF,Mercer Global Investments Management Limited,,2019-02-20,2026-04-29
Mercer Passive Low Volatility Equity UCITS CCF,Mercer Global Investments Management Limited,,2019-02-20,2026-04-29
NFU Mutual Global Alpha Fund,Mercer Global Investments Management Limited,,2019-02-20,2026-04-29
NFU Mutual Global Regional Core Fund,Mercer Global Investments Management Limited,,2019-02-20,2026-04-29
NFU Mutual Global Strategic Fund,Mercer Global Investments Management Limited,,2019-02-20,2026-04-29
State Street USD Liquidity VNAV Fund,BNP Paribas Asset Management Europe,,2019-02-18,2026-04-29
State Street EUR Liquidity VNAV Fund,BNP Paribas Asset Management Europe,,2019-02-18,2026-04-29
State Street GBP Government Liquidity Fund,BNP Paribas Asset Management Europe,,2019-02-18,2026-04-29
State Street GBP Liquidity VNAV Fund,BNP Paribas Asset Management Europe,,2019-02-18,2026-04-29
State Street EUR Government Liquidity Fund,BNP Paribas Asset Management Europe,,2019-02-18,2026-04-29
ANIMA Brightview 2027-I,BNP Paribas Asset Management Europe,,2019-02-15,2026-04-29
Quilter Investors Compass 2 Portfolio,Fineco Asset Management dac,,2019-02-14,2026-04-29
Quilter Cheviot International Balanced Portfolio,Fineco Asset Management dac,,2019-02-14,2026-04-29
Quilter Cheviot International Equity Portfolio,Fineco Asset Management dac,,2019-02-14,2026-04-29
Quilter Cheviot International Growth Portfolio,Fineco Asset Management dac,,2019-02-14,2026-04-29
iShares MSCI Japan CTB Enhanced ESG UCITS ETF,HSBC Investment Funds (Luxembourg) SA,HSBC Continental Europe,2019-02-13,2026-04-29
iShares MSCI USA CTB Enhanced ESG UCITS ETF,HSBC Investment Funds (Luxembourg) SA,HSBC Continental Europe,2019-02-13,2026-04-29
iShares MSCI World CTB Enhanced ESG UCITS ETF,HSBC Investment Funds (Luxembourg) SA,HSBC Continental Europe,2019-02-13,2026-04-29
iShares MSCI EM CTB Enhanced ESG UCITS ETF,HSBC Investment Funds (Luxembourg) SA,HSBC Continental Europe,2019-02-13,2026-04-29
iShares MSCI EMU CTB Enhanced ESG UCITS ETF,HSBC Investment Funds (Luxembourg) SA,HSBC Continental Europe,2019-02-13,2026-04-29
iShares MSCI Europe CTB Enhanced ESG UCITS ETF,HSBC Investment Funds (Luxembourg) SA,HSBC Continental Europe,2019-02-13,2026-04-29
Goldman Sachs STVNAV Euro Liquid Reserves Fund,Goldman Sachs Asset Management Fund Services Limited,,2019-02-11,2026-04-29
Invesco CoinShares Global Blockchain UCITS ETF,Invesco Investment Management Limited,,2019-02-08,2026-04-29
JPMorgan ETFs (Ireland) ICAV - BetaBuilders EUR Govt Bond UCITS ETF,Architas Multi-Manager Europe Limited,,2019-02-08,2026-04-29
JPMorgan ETFs (Ireland) ICAV - BetaBuilders UK Gilt UCITS ETF,Architas Multi-Manager Europe Limited,,2019-02-08,2026-04-29
JPMorgan ETFs (Ireland) ICAV - BetaBuilders US Equity UCITS ETF,Architas Multi-Manager Europe Limited,,2019-02-08,2026-04-29
JPMorgan ETFs (Ireland) ICAV - BetaBuilders US Treasury Bond UCITS ETF,Architas Multi-Manager Europe Limited,,2019-02-08,2026-04-29
U Access (IRL) GCA Credit Long/Short UCITS,Goldman Sachs Asset Management Fund Services Limited,,2019-02-08,2026-04-29
ASI HFRI-I Liquid Alternatives UCITS Fund,Architas Multi-Manager Europe Limited,,2019-02-01,2026-04-29
BNY Mellon Blockchain Innovation Fund,BNY Mellon Fund Management (Luxembourg) S.A,,2019-01-31,2026-04-29
Chelodina UCITS Fund,International Financial Services Centre,,2019-01-25,2026-04-29
iShares $ Treasury Bond 0-1yr UCITS ETF,BNP Paribas Asset Management Europe,,2019-01-25,2026-04-29
Corum Visio,Corum Butler Asset Management Limited,Caceis Bank,2019-01-23,2026-04-29
PortfolioMetrix Cautious Fund,Architas Multi-Manager Europe Limited,,2019-01-18,2026-04-29
PIMCO Asia High Yield Bond Fund,Jupiter Asset Management Europe Limited,,2019-01-18,2026-04-29
Sigma Select Global Leaders Fund,Architas Multi-Manager Europe Limited,,2019-01-18,2026-04-29
PortfolioMetrix Balanced Fund,Architas Multi-Manager Europe Limited,,2019-01-18,2026-04-29
PortfolioMetrix Global Diversified Fund,Architas Multi-Manager Europe Limited,,2019-01-18,2026-04-29
PortfolioMetrix Global Equity Fund,Architas Multi-Manager Europe Limited,,2019-01-18,2026-04-29
Invesco MDAX® UCITS ETF,Invesco Investment Management Limited,,2019-01-17,2026-04-29
Invesco S&P Smallcap 600 UCITS ETF,Invesco Investment Management Limited,,2019-01-16,2026-04-29
FSSA China A Shares Fund,Mediolanum International Funds Limited,Caceis Bank,2019-01-15,2026-04-29
BlackRock ICS US Dollar Liquid Environmentally Aware Fund,Janus Henderson Investors Europe S.A.,,2019-01-14,2026-04-29
BlackRock ICS Sterling Liquid Environmentally Aware Fund,Janus Henderson Investors Europe S.A.,,2019-01-14,2026-04-29
FTGF Western Asset US Dollar Liquidity Fund,Franklin Templeton International Services S.A.R.L.,,2019-01-14,2026-04-29
Man GLG Strategic Bond,Goldman Sachs Asset Management Fund Services Limited,,2019-01-11,2026-04-29
Janus Henderson Absolute Return Income Fund (EUR),Janus Henderson Investors Europe S.A.,,2019-01-11,2026-04-29
Janus Henderson Intech Global Absolute Return Fund,Janus Henderson Investors Europe S.A.,,2019-01-11,2026-04-29
Kirkoswald Emerging Markets Unconstrained Bond Fund,VanEck Asset Management B.V.,,2019-01-10,2026-04-29
Amundi Marathon Emerging Markets Bond Fund,Amundi Asset Management,,2019-01-10,2026-04-29
PineBridge China A-Shares Quantitative Fund,DWS Investment SA,,2019-01-09,2026-04-29
State Street SPDR MSCI World UCITS ETF,Architas Multi-Manager Europe Limited,,2019-01-04,2026-04-29
Fortem Capital Alternative Growth Fund,Architas Multi-Manager Europe Limited,,2019-01-03,2026-04-29
Wellington Blended Opportunistic Emerging Markets Debt Fund,Janus Henderson Investors Europe S.A.,,2019-01-02,2026-04-29
Wellington Global Impact Bond Fund,Janus Henderson Investors Europe S.A.,,2019-01-02,2026-04-29
Wellington Global Stewards Fund,Janus Henderson Investors Europe S.A.,,2019-01-02,2026-04-29
CIFC Global Floating Rate Credit Fund,International Financial Services Centre,,2018-12-31,2026-04-29
Man GLG Credit Multi-Strategy Alternative,LGIM Managers (Europe) Limited,,2018-12-21,2026-04-29
Thornburg Strategic Income Fund,Virtus International Fund Management Limited,,2018-12-21,2026-04-29
dVAM Growth Active PCP,VanEck Asset Management B.V.,,2018-12-21,2026-04-29
Pacific G10 Macro Rates,VanEck Asset Management B.V.,,2018-12-21,2026-04-29
dVAM Cautious Active PCP,VanEck Asset Management B.V.,,2018-12-21,2026-04-29
Polen Capital 5Perspectives U.S. Small Fund,Amundi Asset Management,,2018-12-21,2026-04-29
dVAM Balanced Active PCP,VanEck Asset Management B.V.,,2018-12-21,2026-04-29
Global Absolute Return Fund,Perpetual Investment Services Europe Limited,,2018-12-21,2026-04-29
Prescient Global Balanced Fund,Architas Multi-Manager Europe Limited,,2018-12-21,2026-04-29
Polen Capital International Growth Fund,Amundi Asset Management,,2018-12-21,2026-04-29
Man High Yield Opportunities,LGIM Managers (Europe) Limited,,2018-12-21,2026-04-29
Integrity Global Flexible Fund,Architas Multi-Manager Europe Limited,,2018-12-21,2026-04-29
Portolan Equity UCITS Fund,Fineco Asset Management dac,,2018-12-21,2026-04-29
ARGA European Equity Fund,Architas Multi-Manager Europe Limited,,2018-12-21,2026-04-29
Dalton Asia Pacific UCITS Fund,Fineco Asset Management dac,,2018-12-21,2026-04-29
Portolan Funds ICAV,Fineco Asset Management dac,,2018-12-21,2026-04-29
Trium Multi-Strategy UCITS Fund,WisdomTree Management Limited,,2018-12-19,2026-04-29
New Capital Global Balanced Fund,HSBC Continental Europe,,2018-12-19,2026-04-29
Lazard Scandinavian High Quality Bond Fund,Invesco Investment Management Limited,,2018-12-18,2026-04-29
Yuki India Fund,"Generali Investments CEE investiční společnost, a.s.",,2018-12-17,2026-04-29
Guinness Multi-Asset Balanced Fund,LGIM Managers (Europe) Limited,,2018-12-17,2026-04-29
GMO Emerging Country Debt UCITS Fund,Aegon Investment Management B.V.,,2018-12-17,2026-04-29
Guinness Multi-Asset Growth Fund,LGIM Managers (Europe) Limited,,2018-12-17,2026-04-29
iShares Electric Vehicles and Driving Technology UCITS ETF,HSBC Investment Funds (Luxembourg) SA,HSBC Continental Europe,2018-12-14,2026-04-29
Selection US Equity,Architas Multi-Manager Europe Limited,,2018-12-14,2026-04-29
iShares MSCI ACWI SRI UCITS ETF,HSBC Investment Funds (Luxembourg) SA,HSBC Continental Europe,2018-12-14,2026-04-29
Blackwall Europe Equity Fund,Fineco Asset Management dac,,2018-12-13,2026-04-29
S&P 500 Index FAM Fund,Fineco Asset Management dac,,2018-12-12,2026-04-29
STOXX Europe 600 Index FAM Fund,Fineco Asset Management dac,,2018-12-12,2026-04-29
New Capital Asia Future Leaders Fund,HSBC Continental Europe,,2018-12-12,2026-04-29
FAM MSCI AC Asia Pacific Ex Japan Index Fund,Fineco Asset Management dac,,2018-12-12,2026-04-29
FAM MSCI World Index Fund,Fineco Asset Management dac,,2018-12-12,2026-04-29
FAM MSCI Emerging Markets Index Fund,Fineco Asset Management dac,,2018-12-12,2026-04-29
Fineco AM Europe Growth,Fineco Asset Management dac,,2018-12-11,2026-04-29
Fineco AM US Growth,Fineco Asset Management dac,,2018-12-11,2026-04-29
Fineco AM Emerging Markets Growth,Fineco Asset Management dac,,2018-12-11,2026-04-29
Fineco AM Asia Pacific Growth,Fineco Asset Management dac,,2018-12-11,2026-04-29
Fineco AM Advisory 7,Fineco Asset Management dac,,2018-12-11,2026-04-29
Fineco AM Advisory 6,Fineco Asset Management dac,,2018-12-11,2026-04-29
Fineco AM Advisory 5,Fineco Asset Management dac,,2018-12-11,2026-04-29
FAM Evolution ICAV,Fineco Asset Management dac,,2018-12-11,2026-04-29
Goodbody Vantage 70,International Financial Services Centre,,2018-12-11,2026-04-29
Fineco AM Advisory 4,Fineco Asset Management dac,,2018-12-11,2026-04-29
Lynx UCITS Fund,NS Partners Europe SA,,2018-12-11,2026-04-29
Lynx Active Balanced Fund,NS Partners Europe SA,,2018-12-11,2026-04-29
Goodbody Vantage 90,International Financial Services Centre,,2018-12-11,2026-04-29
Goodbody Vantage 50,International Financial Services Centre,,2018-12-11,2026-04-29
FAM Alternative Conviction,Fineco Asset Management dac,,2018-12-11,2026-04-29
Global Billionaires Fund,Alma Capital Investment Management,Caceis Bank,2018-12-10,2026-04-29
Virtus GF Select High Yield Fund,Virtus International Fund Management Limited,,2018-12-05,2026-04-29
dVAM Global Equity Income PCP,VanEck Asset Management B.V.,,2018-12-05,2026-04-29
The Harding Loevner Global Small Companies Equity Fund,Summit Asset Managers Limited,,2018-12-04,2026-04-29
Vanguard Global Aggregate Bond UCITS ETF,Virtus International Fund Management Limited,,2018-12-03,2026-04-29
Lancaster Absolute Return (Irl) Fund,Virtus International Fund Management Limited,,2018-12-03,2026-04-29
GQG Partners Global Equity Fund,VanEck Asset Management B.V.,,2018-12-03,2026-04-29
Sturdza Family Fund,Opportunity Fund Management,Caceis Bank,2018-11-29,2026-04-29
Acadian China A Equity UCITS,Summit Asset Managers Limited,,2018-11-29,2026-04-29
Acadian European Managed Volatility Equity UCITS,Summit Asset Managers Limited,,2018-11-29,2026-04-29
AD Global MENA Fixed Income UCITS Fund,NS Partners Europe SA,,2018-11-28,2026-04-29
AD Global Emerging Market Debt Local Currency UCITS Fund,NS Partners Europe SA,,2018-11-28,2026-04-29
AD Global Emerging Market Debt Hard Currency UCITS Fund,NS Partners Europe SA,,2018-11-28,2026-04-29
Invest AD UCITS ICAV,NS Partners Europe SA,,2018-11-28,2026-04-29
Fairtree Global Flexible Income Plus Fund,Architas Multi-Manager Europe Limited,,2018-11-28,2026-04-29
AD Global Sukuk UCITS Fund,NS Partners Europe SA,,2018-11-28,2026-04-29
Xtrackers S&P Europe ex UK UCITS ETF,DWS Investment SA,,2018-11-27,2026-04-29
Xtrackers Future Mobility UCITS ETF,DWS Investment SA,,2018-11-27,2026-04-29
Xingtai China Fund,Aegon Investment Management B.V.,,2018-11-27,2026-04-29
Xtrackers Artificial Intelligence and Big Data UCITS ETF,DWS Investment SA,,2018-11-27,2026-04-29
Diamond Futurity Fund,Goldman Sachs Asset Management Fund Services Limited,,2018-11-26,2026-04-29
L&G Emerging Markets Government Bond (Local Currency) Screened Index,LGIM Managers (Europe) Limited,,2018-11-23,2026-04-29
L&G Emerging Markets Government Bond (USD) Screened Index Fund,LGIM Managers (Europe) Limited,,2018-11-23,2026-04-29
ANIMA Flexible Bond,BNP Paribas Asset Management Europe,,2018-11-23,2026-04-29
Nippon India Fixed Income Fund,NS Partners Europe SA,,2018-11-16,2026-04-29
NIPPON INDIA Investment Unit Trust,NS Partners Europe SA,,2018-11-16,2026-04-29
Fl Institutional US Equity Selection Fund,Amundi Asset Management,Caceis Bank,2018-11-15,2026-04-29
First Trust Cloud Computing UCITS ETF,First Trust Global Portfolios Management Limited,,2018-11-14,2026-04-29
First Trust IPOX® Europe Equity Opportunities UCITS ETF,First Trust Global Portfolios Management Limited,,2018-11-14,2026-04-29
ANIMA Brightview 2024-V,BNP Paribas Asset Management Europe,,2018-11-13,2026-04-29
Federated Hermes Emerging Markets Debt Fund,Opportunity Fund Management,Caceis Bank,2018-11-13,2026-04-29
Xtrackers MSCI USA Banks UCITS ETF,DWS Investment SA,,2018-11-12,2026-04-29
Acadian Sustainable Multi Factor UCITS,Blackstone Europe Fund Management SARL,,2018-11-07,2026-04-29
CCF Developed World Screened Index Fund,Hanetf Management Limited,,2018-11-06,2026-04-29
BlackRock Common Contractual Funds,Hanetf Management Limited,,2018-11-06,2026-04-29
Ashoka WhiteOak India Opportunities Fund,Hanetf Management Limited,,2018-11-06,2026-04-29
Ashoka WhiteOak ICAV,Hanetf Management Limited,,2018-11-06,2026-04-29
Waverton Real Assets Fund,Franklin Templeton International Services S.A.R.L.,,2018-11-06,2026-04-29
Waverton European Dividend Growth Fund,Franklin Templeton International Services S.A.R.L.,,2018-11-06,2026-04-29
